{
  "schemaVersion": 1,
  "taskId": "t1",
  "buildPlan": "docs/plans/2026-08-14-plan-artifact-skeleton-build.md",
  "repoRoot": ".",
  "ownedScenarios": ["PAS1", "PAS6"],
  "checks": [
    {
      "id": "tests.full",
      "argv": ["npm", "test"],
      "timeoutMs": 30000,
      "scope": ["full"],
      "evidence": ["whole-corpus regression net is green"]
    },
    {
      "id": "tests.task",
      "argv": ["node", "--test", "test/plan-artifact-skeleton.test.js"],
      "timeoutMs": 1000,
      "scope": ["task"],
      "evidence": ["M1 skeleton shape (PAS1): exact H1, ten-section set/order, section-local markers, canonical sentences, intro law", "M5 inventory row (PAS6): nine fields exact, no verification key, 82 rows"]
    },
    {
      "id": "static.refs",
      "argv": ["node", "skills/sdlc/scripts/check-references.mjs"],
      "timeoutMs": 5000,
      "evidence": ["FS11 inverse completeness: the new reference file resolves and carries its inventory row"]
    },
    {
      "id": "static.lint",
      "argv": ["npx", "biome", "check", "test/plan-artifact-skeleton.test.js", "test/spec-artifact-skeleton.test.js", "skills/sdlc/assets/normative-references.json"],
      "timeoutMs": 5000,
      "evidence": ["the task's lintable surfaces are biome-clean (markdown is not a biome target)"]
    }
  ],
  "categories": {
    "tests": {
      "applicability": "required",
      "checkIds": ["tests.full", "tests.task"]
    },
    "static": {
      "applicability": "required",
      "checkIds": ["static.refs", "static.lint"]
    },
    "scenarios": {
      "applicability": "required",
      "evidence": {
        "PAS1": ["tests.task"],
        "PAS6": ["tests.task"]
      }
    },
    "standards": {
      "applicability": "n/a",
      "reason": "no governing standard beyond the declared checks applies to a new reference file plus inventory row"
    },
    "bannedPatterns": {
      "applicability": "n/a",
      "reason": "no task-diff pattern prohibition beyond lint applies to this task"
    }
  }
}
