{
  "schemaVersion": 1,
  "taskId": "ar-t3",
  "buildPlan": "docs/plans/2026-07-12-sdlc-adoption-readiness-build.md",
  "repoRoot": ".",
  "ownedScenarios": ["AR12", "AR2", "AR3", "AR4", "AR6", "AR9"],
  "checks": [
    {
      "id": "tests.git",
      "argv": ["node", "--test", "test/sdlc-status.test.js", "test/readiness-git.test.js"],
      "timeoutMs": 120000,
      "evidence": ["AR2 HEAD-absent completion", "AR3 index/working-tree dirty variants", "AR4 git error fixtures", "AR6 unreadable models/workflow", "AR9 topology matrix", "AR12 compatibility"]
    },
    {
      "id": "static.status",
      "argv": ["node", "--check", "skills/sdlc/scripts/sdlc-status.mjs"],
      "evidence": ["FS8 status command syntax"]
    },
    {
      "id": "static.tests-exist",
      "argv": ["node", "--check", "test/readiness-git.test.js"],
      "evidence": ["New readiness-git test file exists and parses; guards node --test silently skipping missing files"]
    },
    {
      "id": "static.lint",
      "argv": ["npm", "run", "lint"],
      "timeoutMs": 120000,
      "evidence": ["Repository lint and formatting rules"]
    },
    {
      "id": "patterns.diff",
      "argv": ["git", "diff", "--check", "HEAD"],
      "evidence": ["No whitespace-error banned patterns in task diff"]
    }
  ],
  "categories": {
    "tests": {
      "applicability": "required",
      "checkIds": ["tests.git"]
    },
    "static": {
      "applicability": "required",
      "checkIds": ["static.status", "static.tests-exist", "static.lint"]
    },
    "scenarios": {
      "applicability": "required",
      "evidence": {
        "AR12": ["tests.git", "static.lint"],
        "AR2": ["tests.git"],
        "AR3": ["tests.git"],
        "AR4": ["tests.git"],
        "AR6": ["tests.git"],
        "AR9": ["tests.git"]
      }
    },
    "standards": {
      "applicability": "n/a",
      "reason": "Commit-range standard is verified at ar-t5; no additional standard applies to this task."
    },
    "bannedPatterns": {
      "applicability": "required",
      "checkIds": ["patterns.diff"]
    }
  }
}
