{
  "schemaVersion": 1,
  "taskId": "config-versioning-migration-t2",
  "buildPlan": "docs/plans/2026-07-16-config-versioning-migration-build.md",
  "repoRoot": ".",
  "ownedScenarios": ["CV6", "CV7", "CV8", "CV9", "CV10", "CV11", "CV12", "CV13", "CV14", "CV15", "CV16"],
  "checks": [
    {
      "id": "tests.migration",
      "argv": ["node", "--test", "test/migration.test.js", "test/setup-sdlc.test.js"],
      "timeoutMs": 180000,
      "evidence": ["CV6-CV15 fold, recovery, residue, interactive migration, and fresh posture tests"]
    },
    {
      "id": "static.migration",
      "argv": ["node", "--check", "skills/sdlc/scripts/migrate.mjs"],
      "evidence": ["Migration engine syntax"]
    },
    {
      "id": "static.setup",
      "argv": ["node", "--check", "skills/sdlc/scripts/setup-sdlc.mjs"],
      "evidence": ["Setup migration and FS10 surface syntax"]
    },
    {
      "id": "static.tests",
      "argv": ["node", "--check", "test/migration.test.js"],
      "evidence": ["Focused migration test suite exists and parses"]
    },
    {
      "id": "static.lint",
      "argv": ["npm", "run", "lint"],
      "timeoutMs": 120000,
      "evidence": ["Repository formatting and lint rules"]
    },
    {
      "id": "patterns.diff",
      "argv": ["git", "diff", "--check", "HEAD"],
      "evidence": ["No whitespace-error banned patterns in task diff"]
    }
  ],
  "categories": {
    "tests": { "applicability": "required", "checkIds": ["tests.migration"] },
    "static": { "applicability": "required", "checkIds": ["static.migration", "static.setup", "static.tests", "static.lint"] },
    "scenarios": {
      "applicability": "required",
      "evidence": {
        "CV6": ["tests.migration"],
        "CV7": ["tests.migration"],
        "CV8": ["tests.migration"],
        "CV9": ["tests.migration"],
        "CV10": ["tests.migration"],
        "CV11": ["tests.migration"],
        "CV12": ["tests.migration"],
        "CV13": ["tests.migration"],
        "CV14": ["tests.migration"],
        "CV15": ["tests.migration"],
        "CV16": ["tests.migration", "static.setup"]
      }
    },
    "standards": { "applicability": "n/a", "reason": "Full repository compatibility is owned by T5; T2 has no additional external standard." },
    "bannedPatterns": { "applicability": "required", "checkIds": ["patterns.diff"] }
  }
}
