{
  "schemaVersion": 1,
  "taskId": "sp-t1",
  "buildPlan": "docs/plans/2026-07-14-sdlc-skill-relative-path-plumbing-build.md",
  "repoRoot": ".",
  "ownedScenarios": ["SP3", "SP4", "SP5"],
  "checks": [
    { "id": "tests.paths", "argv": ["node", "--test", "test/readiness-lib.test.js", "test/check-lifecycle-git.test.js", "test/extraction.test.js", "test/setup-sdlc.test.js"], "timeoutMs": 120000, "evidence": ["SP3-SP5 path override and compatibility tests"] },
    { "id": "static.lib", "argv": ["node", "--check", "skills/sdlc/scripts/lib.mjs"], "evidence": ["resolver syntax"] },
    { "id": "static.lifecycle", "argv": ["node", "--check", "skills/sdlc/scripts/check-lifecycle.mjs"], "evidence": ["checker syntax"] },
    { "id": "static.lint", "argv": ["npm", "run", "lint"], "timeoutMs": 120000, "evidence": ["lint"] },
    { "id": "patterns.diff", "argv": ["git", "diff", "--check", "HEAD"], "evidence": ["diff whitespace"] }
  ],
  "categories": {
    "tests": { "applicability": "required", "checkIds": ["tests.paths"] },
    "static": { "applicability": "required", "checkIds": ["static.lib", "static.lifecycle", "static.lint"] },
    "scenarios": { "applicability": "required", "evidence": { "SP3": ["tests.paths"], "SP4": ["tests.paths"], "SP5": ["tests.paths"] } },
    "standards": { "applicability": "n/a", "reason": "Installed-consumer acceptance is owned by sp-t2." },
    "bannedPatterns": { "applicability": "required", "checkIds": ["patterns.diff"] }
  }
}
