{
  "schemaVersion": 1,
  "taskId": "t4",
  "buildPlan": "docs/plans/2026-07-22-review-gate-config-model-build.md",
  "repoRoot": ".",
  "ownedScenarios": ["S9", "S11", "S12", "S17"],
  "checks": [
    {
      "id": "tests.t4",
      "argv": ["node", "--test", "test/phase-references.test.js", "test/system-reference.test.js", "test/skill-kernel.test.js", "test/docs.test.js", "test/adr-absorption.test.js", "test/telemetry-emitter.test.js", "test/review-gate-config-v4.test.js"],
      "timeoutMs": 300000,
      "evidence": ["prose+ADR+telemetry+sweep green"]
    },
    {
      "id": "static.lint",
      "argv": ["npm", "run", "lint"],
      "timeoutMs": 120000,
      "evidence": ["repo biome lint"]
    },
    {
      "id": "standards.reconcile",
      "argv": ["node", "-e", "const fs=require('fs');const ok=['skills/sdlc/references/phase-plan.md','skills/sdlc/references/phase-spec.md'].every(f=>/effective approver/.test(fs.readFileSync(f,'utf8')));process.exit(ok?0:1)"],
      "evidence": ["effective-approver reconciliation present in phase-plan/spec"]
    }
  ],
  "categories": {
    "tests": {
      "applicability": "required",
      "checkIds": ["tests.t4"]
    },
    "static": {
      "applicability": "required",
      "checkIds": ["static.lint"]
    },
    "scenarios": {
      "applicability": "required",
      "evidence": {
        "S9": ["tests.t4"],
        "S11": ["tests.t4"],
        "S12": ["tests.t4"],
        "S17": ["tests.t4"]
      }
    },
    "standards": {
      "applicability": "required",
      "checkIds": ["standards.reconcile"]
    },
    "bannedPatterns": {
      "applicability": "n/a",
      "reason": "sweep asserted in tests.t4 (review-gate-config-v4)"
    }
  }
}
