{
  "schemaVersion": 1,
  "taskId": "t2",
  "buildPlan": "docs/plans/2026-08-09-gate-presentation-contract-build.md",
  "repoRoot": ".",
  "ownedScenarios": ["GPC7", "GPC8", "GPC16"],
  "checks": [
    {
      "id": "tests.full",
      "argv": ["npm", "test"],
      "timeoutMs": 300000,
      "scope": ["full"],
      "evidence": ["whole-corpus regression net is green after the §1 moves edit"]
    },
    {
      "id": "tests.task",
      "argv": ["node", "--test", "test/gate-presentation-contract.test.js"],
      "timeoutMs": 120000,
      "scope": ["task"],
      "evidence": [
        "GPC16 §1 moves: G1 naming no mechanism, G2 alternative-or-declare, G3 appetite before converging, G4/G7 bullet routing",
        "GPC7 G4 triggers: exactly three named triggers, no research ceremony outside triggers, both fired and skipped-with-declaration branches, proportionality kept",
        "GPC8 G7 prompt: one prompt not a battery, none identified a complete answer, bind-only-when-binding and no-binding-by-Brainstorm rules"
      ]
    },
    {
      "id": "static.refs",
      "argv": ["node", "skills/sdlc/scripts/check-references.mjs"],
      "timeoutMs": 60000,
      "evidence": ["FS11 inverse completeness: phase-brainstorm.md still resolves with its inventory row after the §1 edit"]
    },
    {
      "id": "static.lint",
      "argv": ["npx", "biome", "check", "test/gate-presentation-contract.test.js"],
      "timeoutMs": 120000,
      "evidence": ["the task's lintable surface (the contract test file) is biome-clean (markdown is not a biome target)"]
    }
  ],
  "categories": {
    "tests": {
      "applicability": "required",
      "checkIds": ["tests.full", "tests.task"]
    },
    "static": {
      "applicability": "required",
      "checkIds": ["static.refs", "static.lint"]
    },
    "scenarios": {
      "applicability": "required",
      "evidence": {
        "GPC7": ["tests.task"],
        "GPC8": ["tests.task"],
        "GPC16": ["tests.task"]
      }
    },
    "standards": {
      "applicability": "n/a",
      "reason": "no governing standard beyond the declared checks applies to a phase-reference section edit plus contract tests"
    },
    "bannedPatterns": {
      "applicability": "n/a",
      "reason": "no task-diff pattern prohibition beyond lint applies to this task"
    }
  }
}
