{
  "schemaVersion": 1,
  "taskId": "t1",
  "buildPlan": "docs/plans/2026-07-24-pv1-task-scoped-tests-build.md",
  "repoRoot": ".",
  "ownedScenarios": ["TST1", "TST10", "TST11", "TST12", "TST14", "TST2", "TST3", "TST4", "TST5", "TST6", "TST7", "TST8", "TST9"],
  "checks": [
    {
      "id": "tests.contract",
      "argv": ["node", "--test", "test/validator-contract.test.js"],
      "timeoutMs": 120000,
      "scope": ["full", "task"],
      "evidence": ["scope shape, Rule A, Rule B, degradations, golden ordering (TST1-TST12)"]
    },
    {
      "id": "tests.frozen",
      "argv": ["node", "--test", "test/frozen-surfaces.test.js"],
      "timeoutMs": 120000,
      "scope": ["task"],
      "evidence": ["FROZEN array reopened to exactly two entries, ASD19 green (TST14)"]
    },
    {
      "id": "static.lint",
      "argv": ["npx", "biome", "check", "skills/sdlc/scripts/validate-task.mjs", "skills/sdlc/schema/task-validation-manifest.schema.json", "test/frozen-surfaces.test.js", "test/validator-contract.test.js"],
      "evidence": ["touched surfaces are biome-clean"]
    }
  ],
  "categories": {
    "tests": {
      "applicability": "required",
      "checkIds": ["tests.contract", "tests.frozen"]
    },
    "static": {
      "applicability": "required",
      "checkIds": ["static.lint"]
    },
    "scenarios": {
      "applicability": "required",
      "evidence": {
        "TST1": ["tests.contract"],
        "TST2": ["tests.contract"],
        "TST3": ["tests.contract"],
        "TST4": ["tests.contract"],
        "TST5": ["tests.contract"],
        "TST6": ["tests.contract"],
        "TST7": ["tests.contract"],
        "TST8": ["tests.contract"],
        "TST9": ["tests.contract"],
        "TST10": ["tests.contract"],
        "TST11": ["tests.contract"],
        "TST12": ["tests.contract"],
        "TST14": ["tests.frozen"]
      }
    },
    "standards": {
      "applicability": "n/a",
      "reason": "no extra governing standard beyond the declared lint check applies"
    },
    "bannedPatterns": {
      "applicability": "n/a",
      "reason": "no task-diff pattern prohibition beyond lint applies to this task"
    }
  }
}
