{
  "schemaVersion": 1,
  "taskId": "pv-t3",
  "buildPlan": "docs/plans/2026-07-12-sdlc-portable-validator-build.md",
  "repoRoot": ".",
  "ownedScenarios": ["PV1", "PV10", "PV11", "PV12", "PV13", "PV2", "PV3", "PV4", "PV5", "PV6", "PV7", "PV8", "PV9"],
  "checks": [
    {
      "id": "tests.full",
      "argv": ["npm", "test"],
      "timeoutMs": 120000,
      "evidence": ["PV1-PV13 integrated scenario suite"]
    },
    {
      "id": "static.lint",
      "argv": ["npm", "run", "lint"],
      "timeoutMs": 120000,
      "evidence": ["Repository lint and formatting rules"]
    },
    {
      "id": "static.runner",
      "argv": ["node", "--check", "skills/sdlc/scripts/validate-task.mjs"],
      "evidence": ["PV2 runner syntax"]
    },
    {
      "id": "static.receipt",
      "argv": ["node", "--check", "skills/sdlc/scripts/verify-task-receipt.mjs"],
      "evidence": ["PV11 receipt verifier syntax"]
    },
    {
      "id": "standards.commits",
      "argv": ["node", "scripts/check-commit-messages.mjs", "origin/main..HEAD"],
      "evidence": ["Conventional Commits repository standard"]
    },
    {
      "id": "patterns.diff",
      "argv": ["git", "diff", "--check", "HEAD"],
      "evidence": ["No whitespace-error banned patterns in feature diff"]
    }
  ],
  "categories": {
    "tests": {
      "applicability": "required",
      "checkIds": ["tests.full"]
    },
    "static": {
      "applicability": "required",
      "checkIds": ["static.lint", "static.runner", "static.receipt"]
    },
    "scenarios": {
      "applicability": "required",
      "evidence": {
        "PV1": ["tests.full"],
        "PV10": ["tests.full"],
        "PV11": ["tests.full"],
        "PV12": ["tests.full"],
        "PV13": ["tests.full"],
        "PV2": ["tests.full"],
        "PV3": ["tests.full"],
        "PV4": ["tests.full"],
        "PV5": ["tests.full"],
        "PV6": ["tests.full"],
        "PV7": ["tests.full"],
        "PV8": ["tests.full"],
        "PV9": ["tests.full"]
      }
    },
    "standards": {
      "applicability": "required",
      "checkIds": ["standards.commits"]
    },
    "bannedPatterns": {
      "applicability": "required",
      "checkIds": ["patterns.diff"]
    }
  }
}
