{
  "schemaVersion": 1,
  "taskId": "t2",
  "buildPlan": "docs/plans/2026-07-22-review-gate-config-model-build.md",
  "repoRoot": ".",
  "ownedScenarios": ["S5", "S6", "S10"],
  "checks": [
    {
      "id": "tests.t2",
      "argv": ["node", "--test", "test/resolve-panel-v3.test.js", "test/config-doc.test.js", "test/setup-config-doc.test.js"],
      "timeoutMs": 300000,
      "evidence": ["resolver+renderer green"]
    },
    {
      "id": "static.lint",
      "argv": ["npm", "run", "lint"],
      "timeoutMs": 120000,
      "evidence": ["repo biome lint"]
    },
    {
      "id": "patterns.no-decompose",
      "argv": ["node", "-e", "const fs=require('fs');const bad=['skills/sdlc/scripts/resolve-panel.mjs','skills/sdlc/scripts/config-doc.mjs'].some(f=>/decomposeGateMode/.test(fs.readFileSync(f,'utf8')));process.exit(bad?1:0)"],
      "evidence": ["decomposeGateMode absent from resolver+renderer"]
    }
  ],
  "categories": {
    "tests": {
      "applicability": "required",
      "checkIds": ["tests.t2"]
    },
    "static": {
      "applicability": "required",
      "checkIds": ["static.lint"]
    },
    "scenarios": {
      "applicability": "required",
      "evidence": {
        "S5": ["tests.t2"],
        "S6": ["tests.t2"],
        "S10": ["tests.t2"]
      }
    },
    "standards": {
      "applicability": "n/a",
      "reason": "covered by tests.t2 assertions"
    },
    "bannedPatterns": {
      "applicability": "required",
      "checkIds": ["patterns.no-decompose"]
    }
  }
}
