{
  "schemaVersion": 1,
  "taskId": "t1",
  "buildPlan": "docs/plans/2026-08-09-spike-exit-rule-build.md",
  "repoRoot": ".",
  "ownedScenarios": ["SER1", "SER2", "SER3", "SER4", "SER5", "SER6", "SER7", "SER8", "SER9", "SER10", "SER11"],
  "checks": [
    {
      "id": "tests.full",
      "argv": ["npm", "test"],
      "timeoutMs": 30000,
      "scope": ["full"],
      "evidence": ["whole-corpus regression net is green"]
    },
    {
      "id": "tests.task",
      "argv": ["node", "--test", "test/gate-presentation-contract.test.js"],
      "timeoutMs": 1000,
      "scope": ["task"],
      "evidence": ["ordered routing, spike checkpoints, exit semantics, evidence rules, and gate invariants are mechanically pinned"]
    },
    {
      "id": "static.lint",
      "argv": ["npx", "biome", "check", "test/gate-presentation-contract.test.js"],
      "timeoutMs": 5000,
      "evidence": ["the task's JavaScript surface is biome-clean"]
    },
    {
      "id": "static.references",
      "argv": ["node", "skills/sdlc/scripts/check-references.mjs"],
      "timeoutMs": 5000,
      "evidence": ["public reference inventory and links remain valid"]
    }
  ],
  "categories": {
    "tests": {
      "applicability": "required",
      "checkIds": ["tests.full", "tests.task"]
    },
    "static": {
      "applicability": "required",
      "checkIds": ["static.lint", "static.references"]
    },
    "scenarios": {
      "applicability": "required",
      "evidence": {
        "SER1": ["tests.task"],
        "SER2": ["tests.task"],
        "SER3": ["tests.task"],
        "SER4": ["tests.task"],
        "SER5": ["tests.task"],
        "SER6": ["tests.task"],
        "SER7": ["tests.task"],
        "SER8": ["tests.task"],
        "SER9": ["tests.task"],
        "SER10": ["tests.task"],
        "SER11": ["tests.task"]
      }
    },
    "standards": {
      "applicability": "n/a",
      "reason": "no governing standard beyond the declared reference and lint checks applies to this prose-and-contract-test task"
    },
    "bannedPatterns": {
      "applicability": "n/a",
      "reason": "the anti-restatement prohibition is mechanically covered by tests.task"
    }
  }
}
