{
  "schemaVersion": 1,
  "taskId": "ar-t1",
  "buildPlan": "docs/plans/2026-07-12-sdlc-adoption-readiness-build.md",
  "repoRoot": ".",
  "ownedScenarios": ["AR12", "AR5", "AR6"],
  "checks": [
    {
      "id": "tests.readiness-lib",
      "argv": ["node", "--test", "test/readiness-lib.test.js", "test/extraction.test.js", "test/hooks.test.js"],
      "timeoutMs": 120000,
      "evidence": ["AR5/AR6 non-fatal inspection seams", "AR12 existing collector/validator compatibility"]
    },
    {
      "id": "static.lib",
      "argv": ["node", "--check", "skills/sdlc/scripts/lib.mjs"],
      "evidence": ["Shared library syntax"]
    },
    {
      "id": "static.tests-exist",
      "argv": ["node", "--check", "test/readiness-lib.test.js"],
      "evidence": ["New readiness-lib test file exists and parses; guards node --test silently skipping missing files"]
    },
    {
      "id": "static.lint",
      "argv": ["npm", "run", "lint"],
      "timeoutMs": 120000,
      "evidence": ["Repository lint and formatting rules"]
    },
    {
      "id": "patterns.diff",
      "argv": ["git", "diff", "--check", "HEAD"],
      "evidence": ["No whitespace-error banned patterns in task diff"]
    }
  ],
  "categories": {
    "tests": {
      "applicability": "required",
      "checkIds": ["tests.readiness-lib"]
    },
    "static": {
      "applicability": "required",
      "checkIds": ["static.lib", "static.tests-exist", "static.lint"]
    },
    "scenarios": {
      "applicability": "required",
      "evidence": {
        "AR12": ["tests.readiness-lib", "static.lint"],
        "AR5": ["tests.readiness-lib"],
        "AR6": ["tests.readiness-lib"]
      }
    },
    "standards": {
      "applicability": "n/a",
      "reason": "Commit-range standard is verified at ar-t5; no additional standard applies to this task."
    },
    "bannedPatterns": {
      "applicability": "required",
      "checkIds": ["patterns.diff"]
    }
  }
}
