{
  "schemaVersion": 1,
  "taskId": "config-versioning-migration-t3",
  "buildPlan": "docs/plans/2026-07-16-config-versioning-migration-build.md",
  "repoRoot": ".",
  "ownedScenarios": ["CV21", "CV22", "CV23", "CV24", "CV25", "CV26"],
  "checks": [
    {
      "id": "tests.resolve-panel",
      "argv": ["node", "--test", "test/resolve-panel.test.js", "test/resolve-panel-lifecycle.test.js"],
      "timeoutMs": 180000,
      "evidence": ["CV21-CV26 merged-roster resolution, preference/strict posture, author demotion, refusals, and conservation goldens"]
    },
    {
      "id": "static.resolve-panel",
      "argv": ["node", "--check", "skills/sdlc/scripts/resolve-panel.mjs"],
      "evidence": ["Merged-roster resolver syntax"]
    },
    {
      "id": "static.tests",
      "argv": ["node", "--check", "test/resolve-panel.test.js"],
      "evidence": ["Focused resolver test suite exists and parses"]
    },
    {
      "id": "static.lint",
      "argv": ["npm", "run", "lint"],
      "timeoutMs": 120000,
      "evidence": ["Repository formatting and lint rules"]
    },
    {
      "id": "patterns.diff",
      "argv": ["git", "diff", "--check", "HEAD"],
      "evidence": ["No whitespace-error banned patterns in task diff"]
    }
  ],
  "categories": {
    "tests": { "applicability": "required", "checkIds": ["tests.resolve-panel"] },
    "static": { "applicability": "required", "checkIds": ["static.resolve-panel", "static.tests", "static.lint"] },
    "scenarios": {
      "applicability": "required",
      "evidence": {
        "CV21": ["tests.resolve-panel"],
        "CV22": ["tests.resolve-panel"],
        "CV23": ["tests.resolve-panel"],
        "CV24": ["tests.resolve-panel"],
        "CV25": ["tests.resolve-panel"],
        "CV26": ["tests.resolve-panel"]
      }
    },
    "standards": { "applicability": "n/a", "reason": "Full repository compatibility is owned by T5; T3 has no additional external standard." },
    "bannedPatterns": { "applicability": "required", "checkIds": ["patterns.diff"] }
  }
}
