{
  "schemaVersion": 1,
  "taskId": "t3",
  "buildPlan": "docs/plans/2026-08-14-plan-artifact-skeleton-build.md",
  "repoRoot": ".",
  "ownedScenarios": ["PAS7", "PAS8"],
  "checks": [
    {
      "id": "tests.full",
      "argv": ["npm", "test"],
      "timeoutMs": 30000,
      "scope": ["full"],
      "evidence": ["whole-corpus regression net is green"]
    },
    {
      "id": "tests.task",
      "argv": ["node", "--test", "test/plan-artifact-skeleton.test.js"],
      "timeoutMs": 1000,
      "scope": ["task"],
      "evidence": ["M6 (PAS7): FROZEN equals the pinned 16-entry window list in order", "M7 (PAS8): IDV19 exemption minimal - constant intact, single plan filter, siblings unfiltered, obligation comment present"]
    },
    {
      "id": "tests.idv",
      "argv": ["node", "--test", "test/iteration-disposition.test.js"],
      "timeoutMs": 1000,
      "evidence": ["the reconciled IDV19 and untouched siblings (incl. IDV33) stay green (PAS8)"]
    },
    {
      "id": "static.lint",
      "argv": ["npx", "biome", "check", "test/plan-artifact-skeleton.test.js", "test/frozen-surfaces.test.js", "test/iteration-disposition.test.js"],
      "timeoutMs": 5000,
      "evidence": ["the task's lintable surfaces are biome-clean"]
    }
  ],
  "categories": {
    "tests": {
      "applicability": "required",
      "checkIds": ["tests.full", "tests.task", "tests.idv"]
    },
    "static": {
      "applicability": "required",
      "checkIds": ["static.lint"]
    },
    "scenarios": {
      "applicability": "required",
      "evidence": {
        "PAS7": ["tests.task"],
        "PAS8": ["tests.task", "tests.idv"]
      }
    },
    "standards": {
      "applicability": "n/a",
      "reason": "no governing standard beyond the declared checks applies to two test-file reconciliations"
    },
    "bannedPatterns": {
      "applicability": "n/a",
      "reason": "no task-diff pattern prohibition beyond lint applies to this task"
    }
  }
}
