{
  "schemaVersion": 1,
  "taskId": "t1",
  "buildPlan": "docs/plans/2026-08-06-config-doc-formatter-stability-build.md",
  "repoRoot": ".",
  "ownedScenarios": ["CDFS1", "CDFS2", "CDFS3", "CDFS4", "CDFS5", "CDFS6", "CDFS7", "CDFS8", "CDFS9", "CDFS10", "CDFS11"],
  "checks": [
    {
      "id": "tests.full",
      "argv": ["npm", "test"],
      "timeoutMs": 30000,
      "scope": ["full"],
      "evidence": ["whole-corpus regression net completes within the approved external timeout"]
    },
    {
      "id": "tests.task",
      "argv": ["node", "--test", "test/config-doc.test.js"],
      "timeoutMs": 10000,
      "scope": ["task"],
      "evidence": ["adaptive spans, exact values, format identity, compatibility, collisions, determinism, and runtime boundary"]
    },
    {
      "id": "static.lint",
      "argv": ["npx", "biome", "check", "skills/sdlc/scripts/config-doc.mjs", "test/config-doc.test.js"],
      "timeoutMs": 120000,
      "evidence": ["runtime and focused tests are biome-clean"]
    },
    {
      "id": "static.config",
      "argv": ["node", "skills/sdlc/scripts/config-doc.mjs", "check", "--repo-root", ".", "--format", "json"],
      "timeoutMs": 5000,
      "evidence": ["repository-owned CONFIG.md is byte-identical to the v2 expected render"]
    }
  ],
  "categories": {
    "tests": {
      "applicability": "required",
      "checkIds": ["tests.full", "tests.task"]
    },
    "static": {
      "applicability": "required",
      "checkIds": ["static.lint", "static.config"]
    },
    "scenarios": {
      "applicability": "required",
      "evidence": {
        "CDFS1": ["tests.task"],
        "CDFS2": ["tests.task"],
        "CDFS3": ["tests.task"],
        "CDFS4": ["tests.task"],
        "CDFS5": ["tests.task"],
        "CDFS6": ["tests.task"],
        "CDFS7": ["tests.task"],
        "CDFS8": ["tests.task"],
        "CDFS9": ["tests.task", "static.config"],
        "CDFS10": ["tests.full", "tests.task"],
        "CDFS11": ["tests.task", "static.lint"]
      }
    },
    "standards": {
      "applicability": "n/a",
      "reason": "the approved CommonMark delimiter contract is exercised by focused tests; no external standards runner is installed"
    },
    "bannedPatterns": {
      "applicability": "n/a",
      "reason": "dependency and exact-value prohibitions are executable focused assertions rather than a separate pattern command"
    }
  }
}
