{
  "schemaVersion": 1,
  "taskId": "t3",
  "buildPlan": "docs/plans/2026-07-24-pv1-task-scoped-tests-build.md",
  "repoRoot": ".",
  "ownedScenarios": ["TST15", "TST16"],
  "checks": [
    {
      "id": "static.docs",
      "argv": [
        "node",
        "-e",
        "const fs=require('fs');const has=(f,s)=>fs.readFileSync(f,'utf8').includes(s);const base='docs/specs/2026-07-12-sdlc-portable-validator.md';const checks=[[base,'Amendment: task-scoped test declaration'],[base,'CommandCheck'],[base,'no additional properties'],[base,'worked-example manifest'],[base,'Rule A'],[base,'Rule B'],['skills/sdlc/references/phase-tasks.md','scope'],['skills/sdlc/references/phase-tasks.md','Rule A'],['skills/sdlc/references/phase-tasks.md','Rule B'],['skills/sdlc/references/phase-implement.md','scope'],['skills/sdlc/references/phase-implement.md','Rule A'],['skills/sdlc/references/phase-implement.md','Rule B'],['README.md','scope'],['README.md','regression net']];const bad=checks.filter(([f,s])=>!has(f,s));if(bad.length){console.error('missing:',JSON.stringify(bad));process.exit(1)}process.exit(0)"
      ],
      "evidence": ["base-spec §11 amendment + phase-tasks/phase-implement + README document scope/Rule A/Rule B (TST15, TST16)"]
    }
  ],
  "categories": {
    "tests": {
      "applicability": "n/a",
      "reason": "docs-only task: no behavioural test execution to declare"
    },
    "static": {
      "applicability": "required",
      "checkIds": ["static.docs"]
    },
    "scenarios": {
      "applicability": "required",
      "evidence": {
        "TST15": ["static.docs"],
        "TST16": ["static.docs"]
      }
    },
    "standards": {
      "applicability": "n/a",
      "reason": "no extra governing standard beyond the declared docs check applies"
    },
    "bannedPatterns": {
      "applicability": "n/a",
      "reason": "no task-diff pattern prohibition applies to this docs task"
    }
  }
}
