{
  "schemaVersion": 1,
  "taskId": "ab-t1",
  "buildPlan": "docs/plans/2026-07-13-sdlc-adoption-bundle-build.md",
  "repoRoot": ".",
  "ownedScenarios": ["AB1", "AB2", "AB7"],
  "checks": [
    {
      "id": "tests.check-lifecycle",
      "argv": ["node", "--test", "test/check-lifecycle.test.js"],
      "timeoutMs": 120000,
      "evidence": ["AB1 grammar accept/reject with distinct diagnostics", "AB2 exemption/precedence", "AB7 mode parity and injection inertness"]
    },
    {
      "id": "static.checker",
      "argv": ["node", "--check", "skills/sdlc/scripts/check-lifecycle.mjs"],
      "evidence": ["Checker script syntax"]
    },
    {
      "id": "static.tests-exist",
      "argv": ["node", "--check", "test/check-lifecycle.test.js"],
      "evidence": ["New checker test file exists and parses; guards node --test silently skipping missing files"]
    },
    {
      "id": "static.lint",
      "argv": ["npm", "run", "lint"],
      "timeoutMs": 120000,
      "evidence": ["Repository lint and formatting rules"]
    },
    {
      "id": "patterns.diff",
      "argv": ["git", "diff", "--check", "HEAD"],
      "evidence": ["No whitespace-error banned patterns in task diff"]
    }
  ],
  "categories": {
    "tests": {
      "applicability": "required",
      "checkIds": ["tests.check-lifecycle"]
    },
    "static": {
      "applicability": "required",
      "checkIds": ["static.checker", "static.tests-exist", "static.lint"]
    },
    "scenarios": {
      "applicability": "required",
      "evidence": {
        "AB1": ["tests.check-lifecycle"],
        "AB2": ["tests.check-lifecycle"],
        "AB7": ["tests.check-lifecycle"]
      }
    },
    "standards": {
      "applicability": "n/a",
      "reason": "Commit-range and FS8-untouched standards are verified at ab-t5; no additional standard applies to this task."
    },
    "bannedPatterns": {
      "applicability": "required",
      "checkIds": ["patterns.diff"]
    }
  }
}
