{
  "schemaVersion": 1,
  "taskId": "t4",
  "buildPlan": "docs/plans/2026-08-14-plan-artifact-skeleton-build.md",
  "repoRoot": ".",
  "ownedScenarios": [
    "PAS4",
    "PAS5"
  ],
  "checks": [
    {
      "id": "tests.full",
      "argv": [
        "npm",
        "test"
      ],
      "timeoutMs": 30000,
      "scope": [
        "full"
      ],
      "evidence": [
        "whole-corpus regression net is green"
      ]
    },
    {
      "id": "tests.task",
      "argv": [
        "node",
        "--test",
        "test/plan-artifact-skeleton.test.js"
      ],
      "timeoutMs": 1000,
      "scope": [
        "task"
      ],
      "evidence": [
        "M3 (PAS4): six letters in order, one anchor per A-E with the pinned coverage map, carry paragraph, L1/L2 byte-pins",
        "M4 (PAS5): no canonical rule sentence in the prompt"
      ]
    },
    {
      "id": "static.lint",
      "argv": [
        "npx",
        "biome",
        "check",
        "test/plan-artifact-skeleton.test.js"
      ],
      "timeoutMs": 5000,
      "evidence": [
        "the task's lintable surface is biome-clean (markdown is not a biome target)"
      ]
    }
  ],
  "categories": {
    "tests": {
      "applicability": "required",
      "checkIds": [
        "tests.full",
        "tests.task"
      ]
    },
    "static": {
      "applicability": "required",
      "checkIds": [
        "static.lint"
      ]
    },
    "scenarios": {
      "applicability": "required",
      "evidence": {
        "PAS4": [
          "tests.task"
        ],
        "PAS5": [
          "tests.task"
        ]
      }
    },
    "standards": {
      "applicability": "n/a",
      "reason": "no governing standard beyond the declared checks applies to additive prompt anchors with test pins"
    },
    "bannedPatterns": {
      "applicability": "n/a",
      "reason": "no task-diff pattern prohibition beyond lint applies to this task"
    }
  }
}
